{
  "candidate_sha256": "bbbbbbbbbbbbbbbbbbbbbbbbbbbbbbbbbbbbbbbbbbbbbbbbbbbbbbbbbbbbbbbb",
  "control_probes": [
    {
      "declared_result": "PASS",
      "probe_id": "legacy-access-denied"
    }
  ],
  "environment_id": "prod-eu-1",
  "evidence_manifest": [
    {
      "path": "C:/tmp/evidence.txt",
      "sha256": "eeeeeeeeeeeeeeeeeeeeeeeeeeeeeeeeeeeeeeeeeeeeeeeeeeeeeeeeeeeeeeee"
    }
  ],
  "legacy_dependency_id": "legacy-db-primary",
  "profile_id": "legacy-isolation-profile-v1",
  "schema": "SPIRA_LEGACY_ISOLATION_RESULT_V1",
  "schema_version": "1.0"
}
